{
  "schema_kind": "odd_world_model.adjoint_mapping",
  "schema_version": "v1",
  "mapping_id": "odd_world_model.adjoint.trade_representation.trade_contract_to_product.v1",
  "forward_treatment_ref": "odd_world_model.treatment.trade_representation.to_apra_liquidity.candidate.v1",
  "source_domain": "odd_world_model.domain.trade_representation.fpml_confirmation.v1",
  "target_domain": "odd_world_model.domain.trade_representation.fpml_confirmation.v1",
  "interpret_back_summary": "The commodity swap product surface can be interpreted back as one bounded component of the trade contract state carried by the FpML representation.",
  "preserved_structure": [
    "product_type",
    "product_id",
    "asset_class",
    "effective_date",
    "termination_date"
  ],
  "loss_notes": [],
  "surplus_notes": []
}
